{
  "schemaVersion": 1,
  "corpusId": "sha256:e32499e01e7cda3c27cb9e6e41fd39cd9450065f811d4d374cc3a3270f2916e4",
  "exporterVersion": "0.1.0",
  "exportedAt": "2026-08-01T00:00:00Z",
  "caseIds": [
    "sha256:0000000000000000000000000000000000000000000000000000000000000001",
    "sha256:0000000000000000000000000000000000000000000000000000000000000002",
    "sha256:0000000000000000000000000000000000000000000000000000000000000003",
    "sha256:0000000000000000000000000000000000000000000000000000000000000004",
    "sha256:0000000000000000000000000000000000000000000000000000000000000005",
    "sha256:0000000000000000000000000000000000000000000000000000000000000006",
    "sha256:0000000000000000000000000000000000000000000000000000000000000007",
    "sha256:0000000000000000000000000000000000000000000000000000000000000008",
    "sha256:0000000000000000000000000000000000000000000000000000000000000009",
    "sha256:000000000000000000000000000000000000000000000000000000000000000a",
    "sha256:000000000000000000000000000000000000000000000000000000000000000b",
    "sha256:000000000000000000000000000000000000000000000000000000000000000c",
    "sha256:000000000000000000000000000000000000000000000000000000000000000d",
    "sha256:000000000000000000000000000000000000000000000000000000000000000e",
    "sha256:000000000000000000000000000000000000000000000000000000000000000f",
    "sha256:0000000000000000000000000000000000000000000000000000000000000010",
    "sha256:0000000000000000000000000000000000000000000000000000000000000011",
    "sha256:0000000000000000000000000000000000000000000000000000000000000012",
    "sha256:0000000000000000000000000000000000000000000000000000000000000013",
    "sha256:0000000000000000000000000000000000000000000000000000000000000014"
  ],
  "variantIds": ["baseline", "candidate-a"],
  "rubricId": "review-rubric-v1",
  "labelVersion": "v1",
  "pricingSnapshotId": "pricing-2026-08-01",
  "redactionPolicyVersion": "v1",
  "lane": {
    "laneId": "portable-core-2026-08",
    "laneType": "PORTABLE_CORE_MODEL",
    "baselineVariantId": "baseline",
    "cohortSelectionDigest": "sha256:fed94090c7171e6376b25b31777cc54e6995fd16dc85b5b33daf8501019e7172",
    "cohortWindowId": "sha256:289c234acbfbbcf3b2c653e605491a3266a3cb0e3d2e0f2dadb9f6e45d1bd7eb",
    "allowedDifferenceAxes": ["modelAlias"],
    "executionMode": "OFFLINE_REPLAY"
  },
  "sliceTaxonomy": {
    "taxonomyId": "risk-slices-v1",
    "version": "v1",
    "sliceIds": ["auth", "cross-service"]
  },
  "productionBaselineContracts": {
    "controllerContractId": "controller-v1",
    "validatorContractId": "validator-v1",
    "dedupePolicyId": "dedupe-v1",
    "postingPolicyId": "posting-v1"
  },
  "structuralReceipts": [
    {
      "kind": "EXPORT",
      "digest": "sha256:4d275455b202d9de911a8c524649cb5eeff2180e5b4fddf4621d1f2e7948a321"
    },
    {
      "kind": "MANIFEST",
      "digest": "sha256:80261fe014aa4aee74a1a74dd6a1744f955284b76720d1f160dc8979bc48dc25"
    },
    {
      "kind": "EVAL_PROTOCOL",
      "digest": "sha256:c56493b0f8f3d77dbbbe50470bdbde73464e5cf1d7757fc8bf885254dc4743a3"
    },
    {
      "kind": "ADJUDICATION_PROTOCOL",
      "digest": "sha256:f2fefa0f6cbb61d98d867a8d0e87b487c501d31cb84d5fa380b751932ed2b148"
    },
    {
      "kind": "CANDIDATES",
      "digest": "sha256:d6119dec6cc75babc699d4153b6888bf0769676c490c89e2fd52b7b8f02494d4"
    },
    {
      "kind": "RUBRIC",
      "digest": "sha256:0d8c1dcdf18cfd713576d04aea785c8096990ff860e30bab5c3045d830ca844a"
    },
    {
      "kind": "PRICING",
      "digest": "sha256:9fbca66d774f4b32442ae5b20622ace9207888f9839150b6b359b7473c74b727"
    },
    {
      "kind": "CASE_LABELS",
      "digest": "sha256:7a40c352d8373fd80faa0922fd8e4b5f787feabd5cff3d90c7f6471b72e9761d"
    }
  ]
}
